{
  "$schema": "https://json-schema.org/draft/2020-12/schema",
  "$id": "https://registryops.org/schemas/proof_status.schema.json",
  "title": "RegistryOps Proof Status",
  "type": "object",
  "additionalProperties": false,
  "required": [
    "publication_id",
    "status",
    "anchored_object",
    "anchor_payload_path",
    "anchor_ots_path"
  ],
  "properties": {
    "publication_id": {
      "type": "string",
      "minLength": 1
    },
    "status": {
      "type": "string",
      "enum": [
        "pending_ots",
        "ots_present_unverified",
        "verified"
      ]
    },
    "anchored_object": {
      "type": "string",
      "const": "integrity/merkle_root.txt"
    },
    "anchor_payload_path": {
      "type": "string",
      "const": "integrity/anchor_payload.json"
    },
    "anchor_ots_path": {
      "type": "string",
      "const": "integrity/anchor.ots"
    },
    "last_verified_at": {
      "type": [
        "string",
        "null"
      ],
      "pattern": "^\\d{4}-\\d{2}-\\d{2}T\\d{2}:\\d{2}:\\d{2}Z$"
    },
    "details": {
      "type": [
        "string",
        "null"
      ],
      "maxLength": 500
    },
    "verification_method": {
      "type": [
        "string",
        "null"
      ],
      "maxLength": 200
    },
    "verification_target": {
      "type": [
        "string",
        "null"
      ],
      "enum": [
        "bitcoin",
        null
      ]
    },
    "verification_result": {
      "type": [
        "string",
        "null"
      ],
      "enum": [
        "published_anchor_verified",
        null
      ]
    }
  },
  "allOf": [
    {
      "if": {
        "properties": {
          "status": {
            "const": "verified"
          }
        }
      },
      "then": {
        "required": [
          "last_verified_at",
          "verification_method",
          "verification_target",
          "verification_result"
        ],
        "properties": {
          "last_verified_at": {
            "type": "string",
            "pattern": "^\\d{4}-\\d{2}-\\d{2}T\\d{2}:\\d{2}:\\d{2}Z$"
          },
          "verification_method": {
            "type": "string",
            "minLength": 1,
            "maxLength": 200
          },
          "verification_target": {
            "const": "bitcoin"
          },
          "verification_result": {
            "const": "published_anchor_verified"
          }
        }
      }
    }
  ]
}
