{
  "publication_id": "phase1-000038",
  "status": "ots_present_unverified",
  "anchored_object": "integrity/merkle_root.txt",
  "anchor_payload_path": "integrity/anchor_payload.json",
  "anchor_ots_path": "integrity/anchor.ots",
  "last_verified_at": null,
  "details": "OTS proof attached to the snapshot. External Bitcoin verification still pending.",
  "verification_method": null,
  "verification_target": null,
  "verification_result": null
}
